id;name;image;price;description
1;Samsung Galaxy Edge 2;https://avatars.mds.yandex.net/get-mpic/364668/img_id5636027222104023144.jpeg/orig;73000;Мощный кореец
2;Iphone X;https://avatars.mds.yandex.net/get-mpic/200316/img_id270362589725797013.png/orig;80000;Очередное творение яблочников
3;Nokia 8;https://avatars.mds.yandex.net/get-mpic/397397/img_id6752445806321208103.jpeg/orig;20000;Очередная попытка вернуть былое величие
4;Nexus 5x;/static/nexus5x.webp;25000;LG пока никуда не уходит!
5;iPhone 7;/static/iphone7.webp;50000;А семёрка не теряет актуальности
6;Pixel 2;/static/pixel2.webp;40000;Google тоже имеет, что показать